{"events":[{"actor":"alice","details":{"_original_hmac":"738d72612c406c689c06ec26b12b577792a8cedcf033de7dfa3417a4a82fc915","role":"backend"},"event_type":"task.created","hmac":"f10b20e7eb96d958a0c6ebaab4c39c0131bc1de9353c82f40619a973b80bfcf8","prev_hmac":"0000000000000000000000000000000000000000000000000000000000000000","resource_id":"T-1","resource_type":"task","timestamp":"2026-08-25T00:28:59.730012Z"},{"actor":"orchestrator","details":{"_original_hmac":"aabc0100d2b45b7321b7ee21364af9bfabf179fdc74425adb97f4aa0c7dd183d","task":"T-1"},"event_type":"agent.spawned","hmac":"0a0dc0c2aea1489eac3aba6417bb793025f155a263f422d1a238dbc4ecdb853d","prev_hmac":"f10b20e7eb96d958a0c6ebaab4c39c0131bc1de9353c82f40619a973b80bfcf8","resource_id":"A-1","resource_type":"agent","timestamp":"2026-08-25T00:28:59.730531Z"},{"actor":"alice","details":{"_original_hmac":"59c5cc2dbb755059db33a10f3366eabf5b118c651f045a47da95d13e73da49df","status":"ok"},"event_type":"task.completed","hmac":"879f0ea2a07c70b1d2dcf92d72b1619ef716dfc83053be26744a23c97228c7cf","prev_hmac":"0a0dc0c2aea1489eac3aba6417bb793025f155a263f422d1a238dbc4ecdb853d","resource_id":"T-1","resource_type":"task","timestamp":"2026-08-25T00:28:59.730777Z"}],"formats":{"cose":{"alg":"EdDSA","content_type":"application/vnd.bernstein.audit-receipt+json","cose_sign1_b64":"0oRYSqMBJwN4LGFwcGxpY2F0aW9uL3ZuZC5iZXJuc3RlaW4uYXVkaXQtcmVjZWlwdCtqc29uBFZ0ZXN0LWF1ZGl0LXJlY2VpcHQta2V5oFgggbUcDhmldf+4P1NiFN/hC44ILreoQMLMOZNYb/GGdyNYQBk4u4gC1tAvRlTrF4+gp/qXDdeQSEE/bBTy8ZKPgBDy2GUK0OK7hC8uJbZJOrgHu3wzr4BSohDU5axFoe4KNws=","key_id":"test-audit-receipt-key"},"intoto":{"payload":"eyJfdHlwZSI6Imh0dHBzOi8vaW4tdG90by5pby9TdGF0ZW1lbnQvdjEiLCJwcmVkaWNhdGUiOnsia2luZCI6ImF1ZGl0LXJlY2VpcHQiLCJyYW5nZSI6eyJldmVudF9jb3VudCI6MywiZ2VuZXNpc19wcmV2X2htYWMiOiIwMDAwMDAwMDAwMDAwMDAwMDAwMDAwMDAwMDAwMDAwMDAwMDAwMDAwMDAwMDAwMDAwMDAwMDAwMDAwMDAwMDAwIiwiaGVhZF9obWFjIjoiODc5ZjBlYTJhMDdjNzBiMWQyZGNmOTJkNzJiMTYxOWVmNzE2ZGZjODMwNTNiZTI2NzQ0YTIzYzk3MjI4YzdjZiIsImhlYWRfc2hhMjU2IjoiODFiNTFjMGUxOWE1NzVmZmI4M2Y1MzYyMTRkZmUxMGI4ZTA4MmViN2E4NDBjMmNjMzk5MzU4NmZmMTg2NzcyMyIsInNpbmNlIjoiMjAyMC0wMS0wMVQwMDowMDowMC4wMDAwMDBaIiwidW50aWwiOiIyMTAwLTAxLTAxVDAwOjAwOjAwLjAwMDAwMFoifSwic2NoZW1hX3ZlcnNpb24iOiIxLjAuMCJ9LCJwcmVkaWNhdGVUeXBlIjoiaHR0cHM6Ly9iZXJuc3RlaW4ucnVuL2F0dGVzdGF0aW9ucy9hdWRpdC1yZWNlaXB0L3YxIiwic3ViamVjdCI6W3siZGlnZXN0Ijp7InNoYTI1NiI6IjgxYjUxYzBlMTlhNTc1ZmZiODNmNTM2MjE0ZGZlMTBiOGUwODJlYjdhODQwYzJjYzM5OTM1ODZmZjE4Njc3MjMifSwibmFtZSI6ImF1ZGl0LXJlY2VpcHQtMjAyMC0wMS0wMVQwMDowMDowMC4wMDAwMDBaLTIxMDAtMDEtMDFUMDA6MDA6MDAuMDAwMDAwWiJ9XX0=","payloadType":"application/vnd.in-toto+json","signatures":[{"keyid":"test-audit-receipt-key","sig":"P2DsktgmcntAE+voCDheAYXrZYhZSNfPJWo5QCd29D/MrIWKcfQZjafEtUq5HpopHeu5CsIZJY1DIM5RlLODAw=="}]},"transparency":{"inclusion_proof":{"audit_path":[{"hash":"a332eb3e291f2b57392f77971c370ff877e7826c02cfd853b7fede223cf1bc99","left":true}],"leaf_hash":"1a784cb4f6d4ac0b5b0a391deca9c08f844ae48ad407c41b309a199bafff999f","leaf_index":2},"log_algorithm":"RFC6962-SHA256","rekor":null,"signed_tree_head":{"root_hash":"2aa57bddf0d063c407633c8ce3a501d264b16dbb204e67346bde81efe98ddd82","signature_b64":"9Txa716HmZwDG30PmnWgIPahoNExOVHQwjd7UxEutVkirw0URgwkTOf6J5MTFdPc2OtxUWnwU/bI33TvdLp6BQ==","subject_sha256":"81b51c0e19a575ffb83f536214dfe10b8e082eb7a840c2cc3993586ff1867723","tree_size":3}}},"range":{"event_count":3,"genesis_prev_hmac":"0000000000000000000000000000000000000000000000000000000000000000","head_hmac":"879f0ea2a07c70b1d2dcf92d72b1619ef716dfc83053be26744a23c97228c7cf","head_sha256":"81b51c0e19a575ffb83f536214dfe10b8e082eb7a840c2cc3993586ff1867723","since":"2020-01-01T00:00:00.000000Z","until":"2100-01-01T00:00:00.000000Z"},"receipt_type":"https://bernstein.run/attestations/audit-receipt/v1","schema_version":"1.0.0","signing":{"alg":"EdDSA","key_id":"test-audit-receipt-key","public_key_jwk":{"alg":"EdDSA","crv":"Ed25519","kid":"test-audit-receipt-key","kty":"OKP","x":"4006AbYRLhQp6tYWaEBfTvS-T4hTq-5QedKKxsE__dA"}},"subject":{"digest":{"sha256":"81b51c0e19a575ffb83f536214dfe10b8e082eb7a840c2cc3993586ff1867723"},"name":"audit-receipt-2020-01-01T00:00:00.000000Z-2100-01-01T00:00:00.000000Z"}}
