{"events":[{"actor":"user:operator@example.org","details":{"_original_hmac":"b528552e71a79a5faaff4d41afb7ce79d9bdb64fb896acda1b100ab2d667c1eb","agent_id":"agent-a"},"event_type":"run.started","hmac":"6d5f731a5ec222c2cb480e462ab190272177a6b603e74fa23198697060be4131","prev_hmac":"0000000000000000000000000000000000000000000000000000000000000000","resource_id":"run-auditor-conformance","resource_type":"run","timestamp":"2026-10-03T18:31:26.596188Z"},{"actor":"agent-a","details":{"_original_hmac":"11f91a45a160f3a50e65e495332010f185031dca3a6dd4916520ff5bb5e48192","parent_agent_id":"agent-a"},"event_type":"agent.delegated","hmac":"3cc9c0e3299b0954f7ebdf459e54464fab5a6833c5e297a7b46aefd4a4937e18","prev_hmac":"6d5f731a5ec222c2cb480e462ab190272177a6b603e74fa23198697060be4131","resource_id":"agent-b","resource_type":"agent","timestamp":"2026-10-03T18:31:26.597124Z"},{"actor":"agent-b","details":{"_original_hmac":"5d71cc27695899b7c7a28f69dc96b22593e6257a03fc5fe2c59c155253401a57","server":"mcp://repo-tools.example.invalid","transport":"mcp"},"event_type":"tool.called","hmac":"78c21de259b798a8ce51ec3c5b2594425482dfd6e4b95ab3060e97c5aa0f3c4b","prev_hmac":"3cc9c0e3299b0954f7ebdf459e54464fab5a6833c5e297a7b46aefd4a4937e18","resource_id":"repo.read_file","resource_type":"tool","timestamp":"2026-10-03T18:31:26.597412Z"},{"actor":"repo.read_file","details":{"_original_hmac":"41258f9a31abe10b416cde96e6058ceb54eac0f498becb7e18af1b9c8067fea1","sensitivity":"restricted"},"event_type":"data.read","hmac":"571df04e81d0ca0ac161f75cb8b843915f5ce65825be847e32bb948b43ef0c8b","prev_hmac":"78c21de259b798a8ce51ec3c5b2594425482dfd6e4b95ab3060e97c5aa0f3c4b","resource_id":"config/customer_records.yaml","resource_type":"file","timestamp":"2026-10-03T18:31:26.597733Z"},{"actor":"agent-b","details":{"_original_hmac":"fd6fcb0bdfe3eeeb4a9e6af220c7b9b9bbe08d35d11973cb90d30082dc150024","model":"delegated-worker"},"event_type":"model.request","hmac":"27b771c570fafb95ab40f71e9052b53a647a06c7b23d7b4f937289b205ffef3e","prev_hmac":"571df04e81d0ca0ac161f75cb8b843915f5ce65825be847e32bb948b43ef0c8b","resource_id":"https://models.example.invalid/v1","resource_type":"endpoint","timestamp":"2026-10-03T18:31:26.598089Z"},{"actor":"https://models.example.invalid/v1","details":{"_original_hmac":"0be5811444e42e6e3fd2e9afeb93ddb15265c76fdc7d33eb0e6143563c5ad4f9","finish_reason":"stop"},"event_type":"model.response","hmac":"cf86341716b2513d76f64062c6e6e4e304527b839c7f62a0c073d080c6dfb688","prev_hmac":"27b771c570fafb95ab40f71e9052b53a647a06c7b23d7b4f937289b205ffef3e","resource_id":"https://models.example.invalid/v1","resource_type":"endpoint","timestamp":"2026-10-03T18:31:26.598459Z"},{"actor":"agent-a","details":{"_original_hmac":"6ca81ee540a99091d9daf4a550bef53d2e8a05877818675b9e3d2f6b23692994","source":"model.response"},"event_type":"repo.changed","hmac":"d9f05a1bbc82954499e3c170050fbcaea9a6b08a8f67946e38aff4bc97600843","prev_hmac":"cf86341716b2513d76f64062c6e6e4e304527b839c7f62a0c073d080c6dfb688","resource_id":"src/app/config.py","resource_type":"artifact","timestamp":"2026-10-03T18:31:26.598763Z"},{"actor":"user:operator@example.org","details":{"_original_hmac":"4e9cc3cbaf6ae08157babc58d5b444c72b51a317e326d9948823b4b3853ab8d8","ticks":8},"event_type":"run.completed","hmac":"7de1862d13df6be23d414ec9fec392ab168752d88bf46d3f8427f3c32db5ebb1","prev_hmac":"d9f05a1bbc82954499e3c170050fbcaea9a6b08a8f67946e38aff4bc97600843","resource_id":"run-auditor-conformance","resource_type":"run","timestamp":"2026-10-03T18:31:26.599069Z"}],"formats":{"cose":{"alg":"EdDSA","content_type":"application/vnd.bernstein.audit-receipt+json","cose_sign1_b64":"0oRYS6MBJwN4LGFwcGxpY2F0aW9uL3ZuZC5iZXJuc3RlaW4uYXVkaXQtcmVjZWlwdCtqc29uBFdhdWRpdG9yLWNvbmZvcm1hbmNlLWtleaBYILX2Ix+ud4yNyJs2SDBi2ylAQ4kuQFcZ79ojKPLO2EnGWEAXcANb2vZTv9jdEtpOxNNMvDIOj62IQCU7d3x+bbjVa3KJhMroIsFkKcgbOZVhT/CIoWXvjKT1ODOC3BhjLqkO","key_id":"auditor-conformance-key"},"intoto":{"payload":"eyJfdHlwZSI6Imh0dHBzOi8vaW4tdG90by5pby9TdGF0ZW1lbnQvdjEiLCJwcmVkaWNhdGUiOnsia2luZCI6ImF1ZGl0LXJlY2VpcHQiLCJyYW5nZSI6eyJldmVudF9jb3VudCI6OCwiZ2VuZXNpc19wcmV2X2htYWMiOiIwMDAwMDAwMDAwMDAwMDAwMDAwMDAwMDAwMDAwMDAwMDAwMDAwMDAwMDAwMDAwMDAwMDAwMDAwMDAwMDAwMDAwIiwiaGVhZF9obWFjIjoiN2RlMTg2MmQxM2RmNmJlMjNkNDE0ZWM5ZmVjMzkyYWIxNjg3NTJkODhiZjQ2ZDNmODQyN2YzYzMyZGI1ZWJiMSIsImhlYWRfc2hhMjU2IjoiYjVmNjIzMWZhZTc3OGM4ZGM4OWIzNjQ4MzA2MmRiMjk0MDQzODkyZTQwNTcxOWVmZGEyMzI4ZjJjZWQ4NDljNiIsInNpbmNlIjoiMjAyNi0xMC0wM1QxNzozMToyNi42MDYwODNaIiwidW50aWwiOiIyMDI2LTEwLTAzVDE5OjMxOjI2LjYwNjA4M1oifSwic2NoZW1hX3ZlcnNpb24iOiIxLjAuMCJ9LCJwcmVkaWNhdGVUeXBlIjoiaHR0cHM6Ly9iZXJuc3RlaW4ucnVuL2F0dGVzdGF0aW9ucy9hdWRpdC1yZWNlaXB0L3YxIiwic3ViamVjdCI6W3siZGlnZXN0Ijp7InNoYTI1NiI6ImI1ZjYyMzFmYWU3NzhjOGRjODliMzY0ODMwNjJkYjI5NDA0Mzg5MmU0MDU3MTllZmRhMjMyOGYyY2VkODQ5YzYifSwibmFtZSI6ImF1ZGl0LXJlY2VpcHQtMjAyNi0xMC0wM1QxNzozMToyNi42MDYwODNaLTIwMjYtMTAtMDNUMTk6MzE6MjYuNjA2MDgzWiJ9XX0=","payloadType":"application/vnd.in-toto+json","signatures":[{"keyid":"auditor-conformance-key","sig":"h4/uDl1Yh39hvOHLwaDprmeByO7AayIV2D1Q5Oy3LXAZPscdugbbm3NuS/GdGV6Uftf5wZPeq/9HcYkJbhEmDQ=="}]},"transparency":{"inclusion_proof":{"audit_path":[{"hash":"414668930be09830033eae448952f90b9fef3205d591f924cf8a44b6c26a7e9b","left":true},{"hash":"a7002108dc204709b74075aa91341c364fc0b3d9dd70ccef683629b8a5ab8933","left":true},{"hash":"086cda446d4a5bce25fb0a71c35227c795a34820105fd51050a090b845444c93","left":true}],"leaf_hash":"69288a504855b7595d2a0a2a9a51b6ef38646f33aa24ccca893f334b7ee1f26c","leaf_index":7},"log_algorithm":"RFC6962-SHA256","rekor":null,"signed_tree_head":{"root_hash":"70ec5bcddd1ff89b3ae205b4171861f190c83c7eaa118dd58e8649ae293441b5","signature_b64":"CxBqVx6bxaZ75P38hotGt3NJbCkeQyp2aH0u+uhB7FNDneubfMtz9jW5mwTv+HtJyzKP6QM/3B+pJH807cA3Dg==","subject_sha256":"b5f6231fae778c8dc89b36483062db294043892e405719efda2328f2ced849c6","tree_size":8}}},"range":{"event_count":8,"genesis_prev_hmac":"0000000000000000000000000000000000000000000000000000000000000000","head_hmac":"7de1862d13df6be23d414ec9fec392ab168752d88bf46d3f8427f3c32db5ebb1","head_sha256":"b5f6231fae778c8dc89b36483062db294043892e405719efda2328f2ced849c6","since":"2026-10-03T17:31:26.606083Z","until":"2026-10-03T19:31:26.606083Z"},"receipt_type":"https://bernstein.run/attestations/audit-receipt/v1","schema_version":"1.0.0","signing":{"alg":"EdDSA","key_id":"auditor-conformance-key","public_key_jwk":{"alg":"EdDSA","crv":"Ed25519","kid":"auditor-conformance-key","kty":"OKP","x":"dufXbAhdZ7XxqcjErH9nfLA7A2fC8oVHaCmEn1gHBm0"}},"subject":{"digest":{"sha256":"b5f6231fae778c8dc89b36483062db294043892e405719efda2328f2ced849c6"},"name":"audit-receipt-2026-10-03T17:31:26.606083Z-2026-10-03T19:31:26.606083Z"}}
